job_title,apply_link,date_posted,date_expires,description,required_skills,qualifications,responsibilities,benefits,employment_type,experience_preferred,required_experience_in_months,is_remote,minimum_salary,maximum_salary,country,city,state,company_name,company_website,job_publisher
Cybersecurity Intern,https://www.linkedin.com/jobs/view/cybersecurity-intern-at-saic-4036286057?utm_campaign=google_jobs_apply&utm_source=google_jobs_apply&utm_medium=organic,2024-09-27T06:50:20.000Z,2024-10-27T06:50:20.000Z,"Job ID 2412526

Location WASHINGTON, DC, US

Date Posted 2024-09-26

Category Student

Subcategory Intern

Schedule Full-time

Shift Day Job

Travel No

Minimum Clearance Required None

Clearance Level Must Be Able to Obtain None

Potential for Remote Work No

Description

A trusted leader in cloud, digital engineering, data, and Artificial Intelligence, the nation looks to SAIC to integrate emerging technology to modernize critical missions and enable its national imperatives.

SAIC has undergraduate and graduate-level Cybersecurity opportunities within the Digital and AI Team for Summer 2025. SAICs Digital and AI Team leads the design and operations of integrated Enterprise IT solutions that deliver AI-enabled capabilities and enable data-driven decision making to missions across the Department, Services, and Combatant Commands.

The Intern will provide support in specified area on assignments utilizing established procedures and guidance provided by the assigned mentor. Candidates will have the opportunity to explore all aspects of cybersecurity from technical to support functions. Understand that this short description is not intended to be a detailed nor comprehensive description of duties assigned. Mentors will set the specific duties and responsibilities for the day-to-day activities. This is an entry level position where the intern will be able to apply basic fundamentals, concepts and procedures to expand their classroom knowledge to workforce level experience. This position can be worked 100 remotely with the potential for optional travel to SAIC Headquarters in Washington, DC.

Areas of Interest

Cybersecurity

Zero Trust

Cloud

Policy

Qualifications

Required Education  Qualifications

Bachelors degree or masters degree (complete and/or in work)

Be in good academic standing

Desired Qualifications

A strong desire and willingness to learn more about data goverce and AI/ML in production

An interest in AI for good

Join SAIC Be a part of a team thats passionate about the power of AI to transform the public sector.

Apply Now Interested candidates with a drive for innovation are encouraged to apply. Share your passion, expertise, and leadership by joining our team.

Target salary range Up to 40,000. The estimate displayed represents the typical salary range for this position based on experience and other factors.

SAIC accepts applications on an ongoing basis and there is no deadline.

Covid Policy SAIC does not require COVID-19 vaccinations or boosters. Customer site vaccination requirements must be followed when work is performed at a customer site.",None,"Clearance Level Must Be Able to Obtain None, Bachelors degree or masters degree (complete and/or in work), Be in good academic standing, A strong desire and willingness to learn more about data goverce and AI/ML in production","The Intern will provide support in specified area on assignments utilizing established procedures and guidance provided by the assigned mentor, Candidates will have the opportunity to explore all aspects of cybersecurity from technical to support functions, Mentors will set the specific duties and responsibilities for the day-to-day activities, This is an entry level position where the intern will be able to apply basic fundamentals, concepts and procedures to expand their classroom knowledge to workforce level experience","Target salary range Up to 40,000, The estimate displayed represents the typical salary range for this position based on experience and other factors",FULLTIME,true,,True,,,US,Washington,DC,SAIC,http://saic.com,LinkedIn
Cybersecurity Engineer - Data Loss Prevention (DLP) Specialist,https://www.linkedin.com/jobs/view/cybersecurity-engineer-data-loss-prevention-dlp-specialist-at-phia-llc-4034627814?utm_campaign=google_jobs_apply&utm_source=google_jobs_apply&utm_medium=organic,2024-09-26T20:02:47.000Z,2024-10-26T20:02:47.000Z,"At phia we hire talented and passionate people who are focused on collaborative, meaningful work, providing technical and operational subject matter expertise and support services to our partners and clients.

We are seeking an experienced Cyber Data Loss Prevention (DLP) Engineer to join our team in supporting a large government departments cybersecurity efforts. The ideal candidate will have more than 10 years of experience working with data loss prevention solutions, specifically Microsoft Purview DLP. If you have experience transitioning from Broadcom/Symantec DLP to Microsoft Purview DLP, that is a definite plus In this role, you will be responsible for designing, implementing, and managing a comprehensive data loss prevention program using Microsoft Purview.

As a Cyber DLP Engineer, you will work closely with teams across the IT and cybersecurity groups to ensure the effective implementation of data loss prevention policies across all organization systems. You will be expected to analyze complex technical requirements, design scalable solutions, and collaborate with cybersecurity experts to implement and maintain the DLP system.

Your expertise in Microsoft Purview DLP will enable us to identify and mitigate potential security risks associated with sensitive data, ensuring our customers confidentiality, integrity, and availability. Remote, must be located in the United States, Public Trust.

What Youll Do
 Design, implement, and manage a comprehensive data loss prevention program using Microsoft Purview
 Collaborate with the IT and cybersecurity groups across multiple organizations to ensure the effective implementation of data loss prevention policies across all systems
 Analyze complex technical requirements to design scalable solutions for DLP
 Implement and maintain the DLP system to identify and mitigate potential security risks associated with sensitive data
 Analyze alerts from the DLP system to assess the effectiveness of configuration policies, and tune and optimize configurations
 Work closely with cybersecurity experts to ensure alignment with organizational security goals and objectives
 Develop and maintain documentation, procedures, and guidelines related to DLP
 Provide training and support on Microsoft Purview DLP features and functionality

Education  Experience Requirements
 16 years of relevant experience, or
 AA/AS  14 years of relevant experience, or
 BA/BS  12 years of relevant experience, or
 MA/MS  10 years of relevant experience
 Significant experience with data loss prevention (DLP) solutions, specifically Microsoft Purview DLP
 Experience transitioning from Broadcom/Symantec DLP (or other DLP solutions) to Microsoft Purview DLP
 Strong understanding of Microsoft Purview architecture and capabilities
 Excellent analytical, problem-solving, and communication skills
 Proven ability to work independently and collaboratively in a fast-paced environment
 Other experience supporting various cybersecurity tools and platforms (from an engineering, configuration, operations  maintece perspective) is a plus.

Security Clearance
 U.S. citizenship
 Ability to achieve Public Trust or higher

Who You Are

A proactive problem solver that appreciates the challenges of working in a fast-paced, dynamic environment.

Intellectually curious with a genuine desire to learn and advance your career.

An effective communicator, both verbally and in writing.

Customer service-oriented and mission-focused.

Critical thinker with excellent problem-solving skills

If your experience and qualifications arent a match for this position, you will remain in our database for consideration for future opportunities that may be a better fit.

Who We Are

phia, LLC is a Northern Virginia-based, small business established in 2011 with a focus on Cyber Intelligence, Cyber Security/Defense, Intrusion Analysis  Incident Response, Cyber Architecture  Capability Analysis, Cyber Policy  Strategy, and Information Assurance/Security. we proudly support various agencies and offices within the Department of Defense (DoD), Federal government, and private/commercial entities.

phia values work-life balance and offers the following benefits to full-time employees:

Comprehensive medical insurance to include dental and vision

Short Term  Long-Term Disability

401k Retirement Savings Plan with Company Match

Tuition and Professional Development Assistance Flex Spending Accounts (FSA)

phia does not discriminate on the basis of race, sex, color, religion, age, national origin, marital status, disability, veteran status, genetic information, sexual orientation, gender identity, or any other reason prohibited by law in the provision of employment opportunities and benefits.",None,"The ideal candidate will have more than 10 years of experience working with data loss prevention solutions, specifically Microsoft Purview DLP, If you have experience transitioning from Broadcom/Symantec DLP to Microsoft Purview DLP, that is a definite plus, 16 years of relevant experience, or, AA/AS  14 years of relevant experience, or, BA/BS  12 years of relevant experience, or, MA/MS  10 years of relevant experience, Experience transitioning from Broadcom/Symantec DLP (or other DLP solutions) to Microsoft Purview DLP, Strong understanding of Microsoft Purview architecture and capabilities, Excellent analytical, problem-solving, and communication skills, Proven ability to work independently and collaboratively in a fast-paced environment, Security Clearance, U.S. citizenship, Ability to achieve Public Trust or higher, A proactive problem solver that appreciates the challenges of working in a fast-paced, dynamic environment, Intellectually curious with a genuine desire to learn and advance your career, An effective communicator, both verbally and in writing, Customer service-oriented and mission-focused, Critical thinker with excellent problem-solving skills","In this role, you will be responsible for designing, implementing, and managing a comprehensive data loss prevention program using Microsoft Purview, As a Cyber DLP Engineer, you will work closely with teams across the IT and cybersecurity groups to ensure the effective implementation of data loss prevention policies across all organization systems, You will be expected to analyze complex technical requirements, design scalable solutions, and collaborate with cybersecurity experts to implement and maintain the DLP system, Implement and maintain the DLP system to identify and mitigate potential security risks associated with sensitive data, Analyze alerts from the DLP system to assess the effectiveness of configuration policies, and tune and optimize configurations, Work closely with cybersecurity experts to ensure alignment with organizational security goals and objectives, Develop and maintain documentation, procedures, and guidelines related to DLP, Provide training and support on Microsoft Purview DLP features and functionality","Comprehensive medical insurance to include dental and vision, Short Term  Long-Term Disability, 401k Retirement Savings Plan with Company Match, Tuition and Professional Development Assistance Flex Spending Accounts (FSA)",FULLTIME,true,192,True,,,US,Washington,DC,"phia, LLC",,LinkedIn
Cybersecurity Operations Analyst,https://www.linkedin.com/jobs/view/cybersecurity-operations-analyst-at-american-tower-4036280313?utm_campaign=google_jobs_apply&utm_source=google_jobs_apply&utm_medium=organic,2024-09-27T06:12:10.000Z,2024-10-27T00:08:49.000Z,"Job Description

The Team

We are seeking a Cybersecurity Operations Analyst to join American Towers corporate Information Security team. The team protects the confidentiality, integrity, and availability of data and systems in core systems and platforms. The ideal candidate will possess strong tactical and analytical abilities, along with a deep understanding of cybersecurity principles and incident response procedures. In this role, you will use Microsoft Sentinel to oversee the identification, analysis, containment, and remediation of complex security events and work closely with managed detection and response partners.

Responsibilities

What You Can Offer Us
 Track and analyze key performance indicators and security metrics to measure the effectiveness of the Security Operations Centers (SOC) operations and identify areas for improvement.
 Utilize Microsoft Sentinel to conduct in-depth analyses of security events and alerts escalated from lower-tier analysts, identifying threats and assessing their impacts.
 Use Microsoft Sentinel to develop and implement runbooks, event response plans and procedures including containment, eradication, and recovery strategies to minimize the impact of security incidents and restore normal operations.
 Serve as a subject matter expert on Microsoft Sentinel, Microsoft Defender for Endpoint and Office, and other security technologies, providing guidance and recommendations to enhance the companys defensive capabilities.
 Collaborate with internal stakeholders and external partners to investigate security incidents, gather evidence, and support legal and regulatory compliance requirements.
 Stay up to date on emerging cybersecurity threats and trends, proactively identifying potential risks and vulnerabilities and recommending preventive measures and countermeasures.
 Work with the IT department and internal and external business partners to ensure security is factored into the evaluation, selection, installation and configuration processes of hardware and software.

Qualifications

What You Need to Succeed
 Bachelors degree or equivalent experience required.
 Minimum of 4 years of cybersecurity experience, with a focus on incident response and security operations within a SOC environment required.
 Hands-on experience with Microsoft Sentinel or other security information and event management platforms required.
 Strong analytical and problem-solving skills, with the ability to investigate and analyze complex security incidents, identify root causes, and recommend remediation actions.
 Ability to communicate technical details concisely for the appropriate audience.
 Approximately 5 travel may be required to support the positions responsibilities.
 Strong written and oral communication skills, including the ability to present ideas and suggestions clearly and effectively.
 Ability to work with different functional groups and levels of employees to achieve results effectively and professionally.
 Strong organizational skills; ability to accomplish multiple tasks within the agreed upon timeframes through effective prioritization of duties and functions in a fast-paced environment.

About Us

American Tower is a global digital infrastructure company serving customers through tower sites and other real estate solutions that support connectivity and opportunity, focused on achieving our vision of Building a More Connected World. Our success is rooted in the potential of our people and the power of local teams at our offices and sites across 25 countries.

We are one of the largest global Real Estate Investment Trusts (REITs) and a publicly traded (NYSE:AMT), Fortune 500 Company headquartered in Boston, Massachusetts. The next decade will be an exciting time as we evolve our infrastructure to meet tomorrows needs and position our people to elevate their impact, their potential, and our shared success. Come grow your career with us

For more information about how American Tower is building a more connected world, visit americantower.com.

American Tower is proud to be an equal opportunity employer and will not discriminate against an applicant or employee based on age, sex, sexual orientation, gender identity, race, color, creed, religion, national origin or ancestry, citizenship, marital status, familial status, disability, military or veteran status, genetic information, pregcy, reproductive decisions, or any other characteristic protected under applicable law.",None,"Bachelors degree or equivalent experience required, Minimum of 4 years of cybersecurity experience, with a focus on incident response and security operations within a SOC environment required, Hands-on experience with Microsoft Sentinel or other security information and event management platforms required, Strong analytical and problem-solving skills, with the ability to investigate and analyze complex security incidents, identify root causes, and recommend remediation actions, Ability to communicate technical details concisely for the appropriate audience, Approximately 5 travel may be required to support the positions responsibilities, Strong written and oral communication skills, including the ability to present ideas and suggestions clearly and effectively, Ability to work with different functional groups and levels of employees to achieve results effectively and professionally, Strong organizational skills; ability to accomplish multiple tasks within the agreed upon timeframes through effective prioritization of duties and functions in a fast-paced environment","The team protects the confidentiality, integrity, and availability of data and systems in core systems and platforms, In this role, you will use Microsoft Sentinel to oversee the identification, analysis, containment, and remediation of complex security events and work closely with managed detection and response partners, Utilize Microsoft Sentinel to conduct in-depth analyses of security events and alerts escalated from lower-tier analysts, identifying threats and assessing their impacts, Use Microsoft Sentinel to develop and implement runbooks, event response plans and procedures including containment, eradication, and recovery strategies to minimize the impact of security incidents and restore normal operations, Serve as a subject matter expert on Microsoft Sentinel, Microsoft Defender for Endpoint and Office, and other security technologies, providing guidance and recommendations to enhance the companys defensive capabilities, Collaborate with internal stakeholders and external partners to investigate security incidents, gather evidence, and support legal and regulatory compliance requirements, Stay up to date on emerging cybersecurity threats and trends, proactively identifying potential risks and vulnerabilities and recommending preventive measures and countermeasures, Work with the IT department and internal and external business partners to ensure security is factored into the evaluation, selection, installation and configuration processes of hardware and software",,FULLTIME,false,48,True,,,US,Cary,NC,American Tower,http://www.americantower.com,LinkedIn
Principal Cybersecurity Software Engineer,https://www.jobserve.com/us/en/extjob/PRINCIPAL-CYBERSECURITY-SOFTWARE-ENGINEER-in-Boston-Massachusetts-USA-04895C89BDA28B5EA8/?utm_campaign=google_jobs_apply&utm_source=google_jobs_apply&utm_medium=organic,2024-09-26T13:09:00.000Z,2024-10-26T13:09:00.000Z,"Azure Machine Learning (ML) is at the center of Microsofts Artificial Intelligence (AI) revolution as the world moves towards integrating Artificial Intelligence through Large Language Models (LLMs) into services and applications that impacts millions of people in their day-to-day lives. As aPrincipal Cybersecurity Software Engineerof the Azure Machine Learning (AzureML) Back Plane team, you will be tasked with audting the security posture of AzureML services and application programming interfaces (APIs), implementing best practices like isolation, zero-trust, and monitoring systems.

Microsofts mission is to empower every person and every organization on the planet to achieve more. As employees we come together with a growth mindset, innovate to empower others, and collaborate to realize our shared goals. Each day we build on our values of respect, integrity, and accountability to create a culture of inclusion where everyone can thrive at work and beyond.

 In alignment with our Microsoft values, we are committed to cultivating an inclusive work environment for all employees to positivelyimpactour culture every day. Required/Minimum Qualifications: Bachelors Degree in Computer Science, or related technical discipline AND 6 years technical engineering experience with coding in languages including, but not limited to, C, C, C, Java, JavaScript, or PythonOR equivalent experience.6 years experience working in large-scale high security software systems.

Experience with cyber-security best practices. Other Requirements:Ability to meet Microsoft, customer and/or government security screening requirements are required for this role. These requirements include but are not limited to the following specialized security screenings: Microsoft Cloud Background Check: This position will be required to pass the Microsoft Cloud background check upon hire/transfer and every two years thereafter.

Preferred/Additional Qualifications: Bachelors Degree in Computer Science or related technical field AND 8 years technical engineering experience with coding in languages including, but not limited to, C, C, C, Java, JavaScript, or Python. OR equivalent experience. Software Engineering IC5 - The typical base pay range for this role across the U.S.

is USD 137,600 - 267,000 per year. There is a different range applicable to specific work locations, within the San Francisco Bay area and New York City metropolitan area, and the base pay range for this role in those locations is USD 180,400 - 294,000 per year.Certain roles may be eligible for benefits and other compensation.

Find additional benefits and pay information here: Microsoft will accept applications for the role until September 24, 2024. Microsoft is an equal opportunity employer. All qualified applicants will receive consideration for employment without regard to age, ancestry, color, family or medical care leave, gender identity or expression, genetic information, marital status, medical condition, national origin, physical or mental disability, political affiliation, protected veteran status, race, religion, sex (including pregcy), sexual orientation, or any other characteristic protected by applicable laws, regulations and ordices.

We also consider qualified applicants regardless of criminal histories, consistent with legal requirements. If you need assistance and/or a reasonable accommodation due to a disability during the application or the recruiting process, please send a request via the Accommodation request form.Benefits/perks listed below may vary depending on the nature of your employment with Microsoft and the country where you work.

and audit AzureML API for best practices, security vulnerabilities. Help identify and implement high impact security initiatives in the AzureML system. Codify security and compliance requirements by building and strengthening system defenses against malicious attacks and exploits.

Contribute to company-wide security efforts like network security rules. Work to monitor and detect potential attacks before they can impact AzureML Embody ourcultureandvalues Employment typeFull-TimeWork siteUp to 100 work from homeRole typeIndividual ContributorDisciplineSoftware EngineeringProfessionSoftware Engineering.",None,"Bachelors Degree in Computer Science, or related technical discipline AND 6 years technical engineering experience with coding in languages including, but not limited to, C, C, C, Java, JavaScript, or PythonOR equivalent experience.6 years experience working in large-scale high security software systems, Experience with cyber-security best practices, Other Requirements:Ability to meet Microsoft, customer and/or government security screening requirements are required for this role, These requirements include but are not limited to the following specialized security screenings: Microsoft Cloud Background Check: This position will be required to pass the Microsoft Cloud background check upon hire/transfer and every two years thereafter","Help identify and implement high impact security initiatives in the AzureML system, Contribute to company-wide security efforts like network security rules","is USD 137,600 - 267,000 per year, There is a different range applicable to specific work locations, within the San Francisco Bay area and New York City metropolitan area, and the base pay range for this role in those locations is USD 180,400 - 294,000 per year, Certain roles may be eligible for benefits and other compensation",FULLTIME,false,96,True,,,US,Boston,MA,Microsoft,http://www.microsoft.com,JobServe
