job_title,apply_link,date_posted,date_expires,description,required_skills,qualifications,responsibilities,benefits,employment_type,experience_preferred,required_experience_in_months,is_remote,minimum_salary,maximum_salary,country,city,state,company_name,company_website,job_publisher
Cloud Cyber Security Specialist Remote / Telecommute Jobs,https://www.clearancejobs.com/jobs/7863916/cloud-cyber-security-specialist?utm_campaign=google_jobs_apply&utm_source=google_jobs_apply&utm_medium=organic,2024-09-23T20:56:32.000Z,2024-11-22T00:00:32.000Z,"Candidates MUST be within commuting distance of Aberdeen Proving Ground, MD. Hybrid work arrangement with one to two days per week expected in the office at APG, MD.

Now on to the details..As part of several openings of ours in Aberdeen Proving Ground, MD, GovStaff is seeking a mid-level Cloud Cyber Security Technical Specialist who may be seeking grow their professional career while serving under a major IT support contract for the Army Test and Evaluation Command (ATEC), Aberdeen Test Center (ATC).

Offering a team oriented challenging work environment, an attractive salary, excellent benefits, and an opportunity to work with a leading tech firm with more than 35 years worth of experience and expertise providing information technology/management, data management, logistics, system engineering, and program management solutions to the Federal Government.

POSITION OVERVIEW:

The selected Cloud Cybersecurity Technical Specialist will focus on ensuring the security of Azure cloud-based applications by performing scan and patch management, cybersecurity planning and policy management, cyber auditing, configuration management, Risk Management Framework (RMF) Authorization Management, and DevSecOps. The Cloud Cybersecurity Technical Specialist will support the ISSM-O in the creation and maintece of all required policies, procedures, diagrams, hardware/software listings, and all other necessary artifacts required to obtain and maintain the ATO.

QUALIFICATIONS:

 Microsoft Certified Azure Administrator Associate (AZ104) or higher

 CASP CE, CCNP Security, GCED, GCIH, CISA, or CISSP (or other DOD 8570 IAT III certification)

 Minimum Secret Security Clearance

 Bachelors degree in a related field (Computer Science, Computer/Software Engineering, CIS or cybersecurity) and 3 years of experience.

 If not in possession of a degree or a degree in non-related field, minimum of 5 years of experience and technical certifications are required

 Proficient with cybersecurity/IT tools such as ACAS, HBSS/ESS, eMASS

 Familiar with DISA Security Technical Implementation Guides (STIGs)

 Knowledge and understanding of NIST 800 series framework, including the Risk Management Framework Process

 Experience in information security, including technical assessment of IT security controls and devices for networks, applications, and systems, particularly cloud-based applications and services in Microsoft Azure

 Experience performing IT audit, IT compliance, enterprise risk management, creating/updating/implementing policy, security scanning, providing security-related technical guidance, and hardening devices

 Subject Matter Expert in evaluating technical risks, understanding how changes in system configuration and/or network architecture affect a systems security posture and risk profile, and evaluating and applying technical cybersecurity measures of IT systems and networks at the enclave level

 Journeyman to expert level experience implementing cybersecurity controls and countermeasures in cloud environments, specifically Microsoft Azure

RESPONSIBILITIES:

 Scan and patch management

 Cybersecurity planning and policy management

 Cyber auditing

 Configuration management

 Risk Management Framework Authorization Management

 DevSecOps

 Incident Response

 Vulnerability Scanning/Audits

 STIG compliance checking

 Configuration Management

 Host Based Security Solution/Endpoint Security Solution

 Network Access Control

 POAM creation

At GovStaff, we operate in strict confidence: We do not share resumes, names, or applications outside of GovStaff, unless given express consent by each candidate. We welcome all cleared professionals to our GovStaff Network, regardless of current job seeking status.

If you feel this key opening may meet your experience and interests, please apply. If this position does not meet your interests or the requirements, all applications are still welcomed. Well gladly hang onto your profile in the event another position opens that could be a match for your experience and interests. GovStaff, and all our business partners, adhere to all EEOC regulations.",None,"Microsoft Certified Azure Administrator Associate (AZ104) or higher, CASP CE, CCNP Security, GCED, GCIH, CISA, or CISSP (or other DOD 8570 IAT III certification), Minimum Secret Security Clearance, Bachelors degree in a related field (Computer Science, Computer/Software Engineering, CIS or cybersecurity) and 3 years of experience, If not in possession of a degree or a degree in non-related field, minimum of 5 years of experience and technical certifications are required, Proficient with cybersecurity/IT tools such as ACAS, HBSS/ESS, eMASS, Familiar with DISA Security Technical Implementation Guides (STIGs), Knowledge and understanding of NIST 800 series framework, including the Risk Management Framework Process, Experience in information security, including technical assessment of IT security controls and devices for networks, applications, and systems, particularly cloud-based applications and services in Microsoft Azure, Experience performing IT audit, IT compliance, enterprise risk management, creating/updating/implementing policy, security scanning, providing security-related technical guidance, and hardening devices, Subject Matter Expert in evaluating technical risks, understanding how changes in system configuration and/or network architecture affect a systems security posture and risk profile, and evaluating and applying technical cybersecurity measures of IT systems and networks at the enclave level, Journeyman to expert level experience implementing cybersecurity controls and countermeasures in cloud environments, specifically Microsoft Azure","The selected Cloud Cybersecurity Technical Specialist will focus on ensuring the security of Azure cloud-based applications by performing scan and patch management, cybersecurity planning and policy management, cyber auditing, configuration management, Risk Management Framework (RMF) Authorization Management, and DevSecOps, The Cloud Cybersecurity Technical Specialist will support the ISSM-O in the creation and maintece of all required policies, procedures, diagrams, hardware/software listings, and all other necessary artifacts required to obtain and maintain the ATO, Incident Response, Vulnerability Scanning/Audits, STIG compliance checking, Host Based Security Solution/Endpoint Security Solution",,FULLTIME,false,60,True,,,US,Aberdeen Proving Ground,MD,GovStaff LLC,,Clearance Jobs
CyberSecurity Risk Management Specialist,https://www.remoterocketship.com/company/intevity/jobs/cybersecurity-risk-management-specialist-top-secret-clearance-required-object-object?utm_campaign=google_jobs_apply&utm_source=google_jobs_apply&utm_medium=organic,2024-09-26T00:00:00.000Z,2024-12-25T00:00:00.000Z,"Description:
 CyberSecurity Risk Management Specialist role in a digital consultancy firm
 Architect secure IaaS and PaaS solutions
 Prepare, categorize, implement, assess, and monitor systems
 Conduct cyber security assessments using security controls

Requirements:
 TS clearance required
 Active Security  Certification
 At least one security certification such as CISM, CRISC, or CISSP
 Experience working in AWS, Azure, or GCP
 Subject matter expertise in conducting security risk assessments
 Highly proficient in knowledge of respective industry best practices
 Knowledge of risk management policies and standards
 Experienced with vulnerability scanning tools
 Familiar with cloud-based security monitoring tools
 Strong MS Office skills and communication skills
 Preferred experience in technology infrastructure management
 Preferred knowledge of the DoD

Benefits:
 Competitive base salary
 Medical, dental, and vision insurance
 Long and short-term disability insurance
 Life insurance
 401k program with company match
 Open PTO plan",None,,,,FULLTIME,false,,True,115000.0,135000.0,,,,Intevity,http://intevity.com,Remote Rocketship
Cybersecurity Architect,https://careers.stellantis.com/job/20750342/cybersecurity-architect-remote?utm_campaign=google_jobs_apply&utm_source=google_jobs_apply&utm_medium=organic,2024-07-22T00:00:00.000Z,,"Build your brand. Tell your story. Take advantage of a rare opportunity to start from the ground up and build something new and original. At Stellantis we are breaking with the past and launching a new software organization built from the ground up. The Stellantis Software Organization (SWx) was established in 2021 with an entirely new vision for the driver experience, and our mission to build the most captivating experiences in the latest frontier of Automotive Technology. We are seeking technology game changers to lead the digital transformation to this new world of automotive technology with a focus on the customer experience. If youre ready to help lead this automotive technology transformation, we want to hear from you. Visit https://careers.fcagroup.com/nextgen/ to learn more.

The Cybersecurity Architect will define cybersecurity concepts and design cybersecurity controls for STLA E/E vehicle architectures to adequately protect road users from new cyber-threats that arise due to the fast-evolving vehicle functions and features.

This position will design the cybersecurity controls implemented in STLA products following a risk based approach and a cybersecurity by design strategy.

The core tasks of the Cybersecurity Architect are summarized here:
 Design cybersecurity controls to provide adequate level of protection in STLA products.
 Define guidelines and applicability criteria of STLA cybersecurity concepts and controls.
 Design cybersecurity architectures for STLA vehicle networks
 Design vehicle firewall mechanisms and rules
 Interact with STLA SW development departments to support the development of the cybersecurity controls

Basic Qualifications:
 Bachelors degree in Computer Science, Computer Engineering, Electrical Engineering or related degree field
 A minimum of 5 years experience in Cybersecurity
 Strong knowledge and understanding of common cybersecurity patterns (e.g., authentication, authorization, separation of privileges, sandboxing, need to know, separation of duties, )
 Good knowledge of security protocols (e.g., IPSec, TLS, SSH, )
 Good Knowledge of X.509 digital certificate standard and Public Key Infrastructure management
 Good Knowledge of symmetric and asymmetric cryptographic algorithms (e.g., RSA, AES)
 Basic knowledge in C/C programming language
 Basic knowledge of scripting language (e.g., jscript, bash, )
 Basic knowledge of UML language
 Basic knowledge of software engineering

Preferred Qualifications:
 Masters Degree in Engineering
 Good knowledge of ISO 21434: Road Vehicle - Cybersecurity Engineering
 Good knowledge of the Object Oriented Programming paradigm
 Good knowledge of Service Oriented Architecture design pattern and paradigm
 Good knowledge of web services architectures
 Ability to work in multicultural teams
 Strong skills in technical writing and presenting
 Good self-organization and analytical skills
 Good proficiency in English

EOE / Disability / Veteran

At Stellantis, we assess candidates based on qualifications, merit and business needs. We welcome applications from people of all gender identities, age, ethnicity, nationality, religion, sexual orientation and disability. Diverse teams will allow us to better meet the evolving needs of our customers and care for our future.",None,"Bachelors degree in Computer Science, Computer Engineering, Electrical Engineering or related degree field, A minimum of 5 years experience in Cybersecurity, Strong knowledge and understanding of common cybersecurity patterns (e.g., authentication, authorization, separation of privileges, sandboxing, need to know, separation of duties, ), Good knowledge of security protocols (e.g., IPSec, TLS, SSH, ), Good Knowledge of X.509 digital certificate standard and Public Key Infrastructure management, Good Knowledge of symmetric and asymmetric cryptographic algorithms (e.g., RSA, AES), Basic knowledge in C/C programming language, Basic knowledge of scripting language (e.g., jscript, bash, ), Basic knowledge of UML language, Basic knowledge of software engineering","The Cybersecurity Architect will define cybersecurity concepts and design cybersecurity controls for STLA E/E vehicle architectures to adequately protect road users from new cyber-threats that arise due to the fast-evolving vehicle functions and features, This position will design the cybersecurity controls implemented in STLA products following a risk based approach and a cybersecurity by design strategy, Design cybersecurity controls to provide adequate level of protection in STLA products, Define guidelines and applicability criteria of STLA cybersecurity concepts and controls, Design vehicle firewall mechanisms and rules, Interact with STLA SW development departments to support the development of the cybersecurity controls",,FULLTIME,false,60,True,1.0,1000000.0,US,,MI,Stellantis,http://www.fcagroup.com,Careers At Stellantis
"Account Executive, Cybersecurity",https://www.linkedin.com/jobs/view/account-executive-cybersecurity-at-sikich-4034090669?utm_campaign=google_jobs_apply&utm_source=google_jobs_apply&utm_medium=organic,2024-09-26T14:30:56.000Z,2024-10-26T14:30:56.000Z,"Description

Account Executive, Cybersecurity (US - Remote)

What to expect when you join the Sikich family

Team members at Sikich have a lot in common while also being part of a rich and diverse group of contributors, creating a distinct and thriving culture. Chief among our commonalities is a desire for growth and a shared unity of purpose in our professional lives. We believe that through diverse perspectives, challenging the status quo and rewarding action, we accelerate innovation and drive growth  for our clients, for ourselves and for our communities.

The professional services landscape continues to evolve. For Sikich, this means we have an opportunity to further cement our leadership position in this industry and continue to grow our organization in increasingly exciting ways. This growth is meaningful for every team member at our company because larger companies simply see more interesting client opportunities and can attract impressively talented individuals like you. Through a dedicated focus on key business priorities and intentionally creating a rewarding employee experience, Sikich has developed into a highly regarded provider of professional services and a sought-after employer of choice.

Do you want to work with other skilled practitioners and serve clients in a way that makes a difference Are you seeking a supportive environment backed by a deep and extensive set of skillsets Are you ready to make an impact and be acknowledged for your contributions If you answered yes to these questions, we see a mutually beneficial and gratifying relationship on the horizon

Are you ready to grow with us

Position Summary

We are searching for an organized, results-driven and highly motivated Account Executive to focus on passionately hunting for new firm clients and maintaining a book of business to grow. The Account Executive will focus on our Cybersecurity portfolio with the opportunity to cross-sell additional lines of business. The Account Executive will play a crucial role in achieving our sales targets and promoting our cybersecurity offerings.

What will you do in this role
 Thrive in a quarterback team selling environment and leverage available resources (solution consulting, professional services, marketing, industry experts, and management) to get the job done and secure the sale
 Possess a hunter mentality with demonstrated success sourcing leads, qualifying opportunities,  closing deals
 A highly tenacious and extremely results driven sales representative who thrives to be at the top of the leader board
 Demonstrated aptitude in acquiring and applying industry expertise successfully in sales cycles
 Track record of achievements and accomplishments that demonstrate strong judgment, sound decision making and a desire to succeed.
 Excellent communication and interpersonal skills, with the ability to build rapport with clients and present complex information in a clear and concise manner. Ability to communicate with executives/C-level and clearly convey the value of our cybersecurity services
 Develop and maintain strong, trusted and mutually beneficial relationships with referral partners, trade associations and buying groups
 Focus on selling into a key industry vertical. Maintain familiarity with industry solutions, business models, trends, and applicable compliance frameworks
 Have a strong executive presence, communication skills, and presentation capabilities
 Develop and maintain a strategic territory plan to sign new customers and hit monthly/quarterly/annual revenue targets
 Manage and accurately update leads, opportunities, and pipeline in CRM

What do you need to succeed in this role
 3 years selling  lead generation experience.
 BA/BS in a business-related field or equivalent work experience
 Experience selling cybersecurity professional services
 Familiarity and/or experience with using MEDDICC/MEDDPICC sales qualification methodology

In addition, specific skills/experience required are as follows:
 Servant Leader  You are hyper focused on engaging employees, fostering their development, and building a positive culture.
 Solutions Focused  You see opportunities in every business problem and can develop, articulate, and implement solutions.
 Collaboration  You are a relationship builder across all levels of the organization and across all business units.
 Instills Trust - You do what you say, and you follow through on commitments, you act with integrity, you are consistent and are perceived as credible.
 Impact  Influence Thinking  You gain support for ideas, proposals, and solutions, and get others to act, with or without formal authority, to advance initiatives/objectives.

About Sikich LLC

Sikich LLC is a global company specializing in Accounting, Advisory, and Technical professional services. With employees across the globe, Sikich ranks as one of the largest professional services companies in the United States. Our comprehensive skillsets, obtained over decades of experience as entrepreneurs, business owners and industry innovators, allow us to provide insights and transformative strategies to help strengthen every dimension of our clients businesses.

Sikich Total Rewards

Our team members enjoy expansive benefits ranging from competitive compensation and insurance options to wellness programs and a flexible time off policy, to name only a few. Sikich also takes pride in prioritizing team members health, total wellbeing and time spent with family, friends and in the pursuit of personal goals, hobbies, and endeavors.

Some examples of our many benefits:
 Sikich maintains a Flexible Time Off (FTO) Policy. We encourage every full-time employee, as your role permits, to utilize paid time off (personal time, mental/physical health care, vacation, sick leave, etc.). Waiting for time off to accrue is common at other companies. At Sikich, you do not have to wait for this benefit to kick in. FTO is activated on your first day with our organization.
 Sikich will also recognize paid holidays during the year and strives to permit employees to have time off the last week of the calendar year when client and project work permits.
 Sikich offers a comprehensive wellness program to engage, challenge and empower team members to take responsibility for their wellbeing. Activities can be tracked through our wellness provider to obtain gift cards and other rewards.

We also offer:
 Flexible work arrangements
 Health, dental, vision, life, and accident/death/disability insurance options
 HSA employer contribution
 Nine (9) paid holidays annually.
 A robust paid Parental Bonding Leave program covering birth, adoption, and foster children.
 401(k) with employer contributions
 CPA bonus with four (4) paid exam days  four (4) paid study days.
 Tuition reimbursement
 Generous employee referral bonus program
 Client referral bonus program
 Pet insurance
 FORCE  Sikich community volunteer program enabling each team member to use up to four hours of paid time annually to volunteer and make a difference in their local communities.

Want to learn more Visit our Careers website or Glassdoor profile.

Sikich LLC is an Equal Opportunity Employer M/F/D/V

Sikich currently practices as an alternative practice structure in accordance with the AICPA Professional Code of Conduct and applicable law, regulations, and professional standards. Sikich CPA LLC is a licensed CPA firm and provides audit and attest services to its clients. Sikich LLC has a contractual arrangement with Sikich CPA LLC whereby Sikich LLC provides Sikich CPA LLC with professional and support personnel and other support services to allow Sikich CPA LLC to perform its professional services and Sikich CPA LLC consults with Sikich LLC and shares client information with Sikich LLC with respect to the provision of such services.",None,"Demonstrated aptitude in acquiring and applying industry expertise successfully in sales cycles, Track record of achievements and accomplishments that demonstrate strong judgment, sound decision making and a desire to succeed, Excellent communication and interpersonal skills, with the ability to build rapport with clients and present complex information in a clear and concise manner, Ability to communicate with executives/C-level and clearly convey the value of our cybersecurity services, 3 years selling  lead generation experience, BA/BS in a business-related field or equivalent work experience, Experience selling cybersecurity professional services, Familiarity and/or experience with using MEDDICC/MEDDPICC sales qualification methodology, Servant Leader  You are hyper focused on engaging employees, fostering their development, and building a positive culture, Collaboration  You are a relationship builder across all levels of the organization and across all business units, Instills Trust - You do what you say, and you follow through on commitments, you act with integrity, you are consistent and are perceived as credible, Impact  Influence Thinking  You gain support for ideas, proposals, and solutions, and get others to act, with or without formal authority, to advance initiatives/objectives","The Account Executive will play a crucial role in achieving our sales targets and promoting our cybersecurity offerings, Thrive in a quarterback team selling environment and leverage available resources (solution consulting, professional services, marketing, industry experts, and management) to get the job done and secure the sale, Possess a hunter mentality with demonstrated success sourcing leads, qualifying opportunities,  closing deals, Develop and maintain strong, trusted and mutually beneficial relationships with referral partners, trade associations and buying groups, Focus on selling into a key industry vertical, Maintain familiarity with industry solutions, business models, trends, and applicable compliance frameworks, Have a strong executive presence, communication skills, and presentation capabilities, Develop and maintain a strategic territory plan to sign new customers and hit monthly/quarterly/annual revenue targets, Manage and accurately update leads, opportunities, and pipeline in CRM","Sikich Total Rewards, Our team members enjoy expansive benefits ranging from competitive compensation and insurance options to wellness programs and a flexible time off policy, to name only a few, Sikich maintains a Flexible Time Off (FTO) Policy, We encourage every full-time employee, as your role permits, to utilize paid time off (personal time, mental/physical health care, vacation, sick leave, etc.). Waiting for time off to accrue is common at other companies, FTO is activated on your first day with our organization, Sikich will also recognize paid holidays during the year and strives to permit employees to have time off the last week of the calendar year when client and project work permits, Sikich offers a comprehensive wellness program to engage, challenge and empower team members to take responsibility for their wellbeing, Flexible work arrangements, Health, dental, vision, life, and accident/death/disability insurance options, HSA employer contribution, Nine (9) paid holidays annually, A robust paid Parental Bonding Leave program covering birth, adoption, and foster children, 401(k) with employer contributions, CPA bonus with four (4) paid exam days  four (4) paid study days, Tuition reimbursement, Generous employee referral bonus program, Client referral bonus program, Pet insurance, FORCE  Sikich community volunteer program enabling each team member to use up to four hours of paid time annually to volunteer and make a difference in their local communities",FULLTIME,false,36,True,,,US,,,Sikich,,LinkedIn
