job_title,apply_link,date_posted,date_expires,description,required_skills,qualifications,responsibilities,benefits,employment_type,experience_preferred,required_experience_in_months,is_remote,minimum_salary,maximum_salary,country,city,state,company_name,company_website,job_publisher
"Senior Consultant - Automotive Functional Safety, SOTIF, AI/ML Safety, Cybersecurity",https://www.builtinaustin.com/job/senior-consultant-automotive-functional-safety-sotif-aiml-safety-cybersecurity/157676?utm_campaign=google_jobs_apply&utm_source=google_jobs_apply&utm_medium=organic,2024-09-18T00:00:00.000Z,2024-10-17T00:00:00.000Z,"JOB DESCRIPTION
UL is seeking a Senior Consultant who will be involved with the safety and cybersecurity work product development for various vehicle features, including complex software-intensive systems such as systems for self-driving vehicles, industrial automation, battery and energy storage in both vehicle and stationary applications etc. The Consultant will lead the development, or review of work products for clients seeking compliance to standards in safety, SOTIF, cybersecurity and related fields, including ISO 26262, IEC 61508, IEC/EN 62061, ISO 61511, ISO 21448, UL 4600, ISO 13849, ISO 21434, ISO 24089, and other similar standards relevant to system, hardware and software engineering safety, and cybersecurity lifecycle.
This is a remote role that can be held anywhere in the US.
RESPONSIBILITIES
 Lead analyses and define requirements based on Customer system, hardware, and software architectures
 Lead design analysis to support the development of safety case arguments for safety related products
 Supports integration of the safety/cybersecurity activities in the development project
 Guide clients on ISO 24089, including guidance with vehicle software update and securing vehicle infrastructure related to software updates
 Create or contribute as necessary to hazard and risk analyses, functional, technical, hardware, and software safety concept for various vehicle systems and components
 Contribute in the product development process, by creating the appropriate work products that meet the requirements of the relevant safety/cybersecurity standards.
 Lead client programs by interacting regularly with clients in technical program meetings and project reviews. Provide technical assistance to clients in reference to safety/cybersecurity and related technical fields. Projects may include regular travel to client sites and to other UL locations.

QUALIFICATIONS
 Bachelors degree in Electrical, Electronics, Computer Science, Mechanical, Automotive, Robotics, Software or Mechatronics Engineering required. Masters degree preferred.
 5-10 years of experience in the Automotive industry.
 At least 3 years of experience in Functional Safety OR Cybersecurity OR Autonomous Safety OR in the area of electronics and embedded systems development for vehicle technologies.
 A strong understanding of Functional Safety, SOTIF, Cybersecurity Standards and Automotive Engineering principles.
 Additional experience with security controls at the vehicle level, secure onboard communication, secure boot, network segmentation, and secure architecture practices.

What youll experience working at UL:
 Mission: For UL, corporate and social responsibility isnt new. Making the world a safer, more secure and sustainable place has been our business model for the last 125 years and is deeply engrained in everything we do.
 People: Ask any UL employee what they love most about working here, and youll almost always hear, the people. Going beyond what is possible is the standard at UL. Were able to deliver the best because we employ the best.
 Interesting work: Every day is different for us here as we eagerly anticipate the next innovation that our customers create. Were inspired to take on the challenge that will transform how people live, work and play. And as a global company, in many roles, you will get international experience working with colleagues around the world.
 Grow  achieve: We learn, work and grow together with targeted development, reward and recognition programs as well as our very own UL University that offers extensive training programs for employees at all stages, including a technical training track for applicable roles.
 Total Rewards: In the US, we provide lots of great benefits for our employees are their families. From Volunteer Days off to 401k match and retirement contribution benefits to flexible work location  schedule options we look to support our employees no matter what stage in life they are experiencing.

The salary range for this position is 107-150K and is based upon years of experience that is commensurate with the level of the position.
All employees at UL Solutions are eligible for annual bonus compensation. The target for this position is 10 of the base salary offered. Employees are eligible for health benefits such as medical, dental and vision; wellness benefits such as mental  ficial health; and retirement savings (401K) commensurate with the standard rewards offered in each individual location or country, for the relevant position level.
We also provide employees with paid time off including vacation (15 days), holiday including floating holidays (12 days) and sick time off (72 hours).
Internal applicants with questions related to the Total Rewards for this position should submit a ticket via askHR for more insights.
The deadline to apply for this position is 2/23/25.
Learn More:
Curious To learn more about us and the work we do, visit our company page www.UL.com
LI-EH1 LI-Remote
ABOUT US
A global leader in applied safety science, UL Solutions (NYSE: ULS) transforms safety, security and sustainability challenges into opportunities for customers in more than 110 countries. UL Solutions delivers testing, inspection and certification services, together with software products and advisory offerings, that support our customers product innovation and business growth. The UL Mark serves as a recognized symbol of trust in our customers products and reflects an unwavering commitment to advancing our safety mission. We help our customers innovate, launch new products and services, navigate global markets and complex supply chains, and grow sustainably and responsibly into the future. Our science is your advantage.
ABOUT THE TEAM
Clients in the automotive and mobility industry have been engaged with UL Solutions for more than 100 years. We serve leading automotive original equipment manufacturers OEMs and their key supply chain partners to bring new and changing technologies to market. Our involvement starts with product design including material selection, carries through to supply chain management and production, and culminates with support for product marketing and positioning. We also work with key international regulatory agencies, local authorities having jurisdiction (AHJs) and manufacturers on the development of consensus-based standards and services that apply to the automotive industry.",None,"Bachelors degree in Electrical, Electronics, Computer Science, Mechanical, Automotive, Robotics, Software or Mechatronics Engineering required","The Consultant will lead the development, or review of work products for clients seeking compliance to standards in safety, SOTIF, cybersecurity and related fields, including ISO 26262, IEC 61508, IEC/EN 62061, ISO 61511, ISO 21448, UL 4600, ISO 13849, ISO 21434, ISO 24089, and other similar standards relevant to system, hardware and software engineering safety, and cybersecurity lifecycle, Lead analyses and define requirements based on Customer system, hardware, and software architectures, Lead design analysis to support the development of safety case arguments for safety related products, Supports integration of the safety/cybersecurity activities in the development project, Guide clients on ISO 24089, including guidance with vehicle software update and securing vehicle infrastructure related to software updates, Create or contribute as necessary to hazard and risk analyses, functional, technical, hardware, and software safety concept for various vehicle systems and components, Contribute in the product development process, by creating the appropriate work products that meet the requirements of the relevant safety/cybersecurity standards, Lead client programs by interacting regularly with clients in technical program meetings and project reviews, Provide technical assistance to clients in reference to safety/cybersecurity and related technical fields, Projects may include regular travel to client sites and to other UL locations","Total Rewards: In the US, we provide lots of great benefits for our employees are their families, From Volunteer Days off to 401k match and retirement contribution benefits to flexible work location  schedule options we look to support our employees no matter what stage in life they are experiencing, The salary range for this position is 107-150K and is based upon years of experience that is commensurate with the level of the position, All employees at UL Solutions are eligible for annual bonus compensation, The target for this position is 10 of the base salary offered, Employees are eligible for health benefits such as medical, dental and vision; wellness benefits such as mental  ficial health; and retirement savings (401K) commensurate with the standard rewards offered in each individual location or country, for the relevant position level, We also provide employees with paid time off including vacation (15 days), holiday including floating holidays (12 days) and sick time off (72 hours)",FULLTIME,false,60,True,0.0,0.0,US,Troy,MI,UL Solutions,http://www.ul.com,Built In Austin
Principal Cybersecurity Architect,https://theorg.com/org/business-wire/jobs/principal-cybersecurity-a-16f2b613?utm_campaign=google_jobs_apply&utm_source=google_jobs_apply&utm_medium=organic,2024-09-08T21:32:45.000Z,,"Business Wire, a Berkshire Hathaway company, is the global market leader in press release distribution and regulatory disclosure. We are on a mission to redefine how organizations connect with their audiences - and thats just the beginning

Organizations, large and small, depend on us to accurately publicize market-moving news and multimedia, and generate social engagements that develop interactions with their target audiences.

About the Role
At Business Wire, we are committed to building a world-class cybersecurity program that sets the standard for excellence in the industry. Our approach is rooted in innovation, resilience, and a deep understanding of the evolving threat landscape while ensuring our core values of attitude and aptitude, collaboration and integrity are at the forefront of all we do. As we continue to grow and protect our global operations, we are seeking top-tier talent to join us in this mission.

The Principal Cybersecurity Architect will lead the development and maintece of a robust enterprise security architecture plan. This critical role will involve close collaboration with leaders across cybersecurity, IT, and operations to ensure the coordination of services and the formulation of a holistic and adaptive security strategy. The Principal Cybersecurity Architect will be instrumental in ensuring that Business Wire maintains a leading architecture that evolves with changing environments, industry requirements, and threats to enhance overall security performance.

What You Will Do
Enterprise Security Architecture Strategy:
- Lead the development and execution of a comprehensive and innovative enterprise security architecture strategy.
- Ensure that stakeholder security requirements are thoroughly addressed across all aspects of enterprise architecture, including reference models, segment and solution architectures, and supporting systems.
- Integrate cybersecurity policies with IT architecture to ensure a cohesive and secure enterprise environment.

Systems Development Life Cycle:
- Ensure security is integrated throughout the system development life cycle and that continuous monitoring practices are in place.
- Translate technological and environmental conditions, such as laws and regulations, into secure system designs and processes.
- Ensure all new systems are deployed in alignment with established architecture standards.

Holistic Security Architecture Development:
- Develop and maintain business, systems, and information processes that support Business Wires mission and enterprise needs.
- Establish and document IT rules and requirements that describe baseline and target architectures, ensuring alignment with organizational goals.

Compliance with Industry Standards:
- Ensure that the enterprise security architecture complies with major industry frameworks, including the NIST Cybersecurity Framework.
- Continuously monitor and update the security architecture to maintain alignment with evolving industry standards and best practices.

Acquisition Life Cycle and Security Integration:
- Document and address the organizations information security, cybersecurity architecture, and systems security engineering requirements throughout the acquisition life cycle.
- Review IT acquisitions for compliance with architecture and policy requirements, ensuring that new systems or interfaces do not compromise the security posture of the current environment.
- Conduct post-integration reviews to assess the effectiveness of newly integrated security solutions, identifying areas for improvement and driving continuous enhancements.

Security Architecture and Risk Management:
- Perform security reviews to identify gaps in the security architecture and develop comprehensive security risk management plans.
- Provide expert advice on project costs, design concepts, and design changes to ensure that existing systems maintain proper security controls and compliance with architecture policies.
- Develop metrics and performance indicators to evaluate the success of integration efforts, ensuring that security solutions deliver expected outcomes and contribute to the overall security posture.

Integrated Security Tools and Technologies:
- Lead the creation of a strategy for a comprehensive suite of integrated and dynamic security tools and monitoring technologies.
- Support system authorization, continuous monitoring, threat detection and response, and other enterprise-level security activities.
- Continuously assess the effectiveness of integrated security tools, making recommendations for optimization or replacement to ensure the organization remains protected against evolving threats.

Continuous Innovation in Security Architecture:
- Drive innovation by researching emerging cybersecurity technologies, trends, and threats. Proactively evaluate their applicability to the organizations security architecture and recommend innovative solutions to enhance the security posture.
- Lead the exploration of advanced security technologies such as zero-trust architectures, artificial intelligence, machine learning, and blockchain to determine their potential integration into the enterprise security framework.
- Develop and maintain a forward-looking technology roadmap for security architecture, identifying opportunities for the adoption of new technologies and methodologies that can enhance security and operational efficiency.

What You Will Need
- A minimum of 10 years of experience in cybersecurity architecture, with at least 5 years in a senior or principal architect role.
- Proven experience in developing and implementing enterprise security architectures and strategies.
- Excellent communication skills, with the ability to articulate complex security concepts to both technical and non-technical stakeholders.
- Expertise in re-architecting and refactoring legacy applications to improve security, scalability, and performance as part of a broader digital transformation initiative.
- Deep understanding of cloud-native security controls, such as identity and access management (IAM), encryption, network security, and security monitoring in cloud environments.
- Experience in automating cloud security tasks such as compliance checks, vulnerability assessments, and threat detection using cloud-native and third-party tools.
- Skills in innovation and finding solutions to complex problems.
- Proven experience with software development methodologies, including waterfall, agile, and DevSecOps.
- Strong understanding of the NIST Framework(s), Open Group Architecture Framework (TOGAF), Sherwood Applied Business Security Architecture (SABSA), MITRE ATTCK Framework, Open Security Architecture (OSA) and other relevant industry standards.
- Bachelors degree in Cybersecurity, Information Technology, Computer Science, or a related field. A Masters degree is preferred.
 Business Wire will not sponsor a new applicant for employment authorization for this position.LI-DNI
 What We OfferThe base salary range for this position is 180K to 200K/year. Offered salary will be determined by several factors, including but not limited to: applicants education, experience, knowledge, skills and abilities, as well as internal equity and alignment with geographic market data. Business Wire reserves the right to modify this salary range at any time.
Business Wires total rewards include:- Ability to work remotely
- Excellent health benefits that begin on your first day of employment
- 100 monthly fitness allotment, a tuition reimbursement program, and enhanced mental health resources
- 401(k) plan with generous company match, and annual profit sharing contribution (subject to company performance)
- PTO, Floating Holidays, Wellness Day Off, Birthday Day Off, and more",None,"Continuously assess the effectiveness of integrated security tools, making recommendations for optimization or replacement to ensure the organization remains protected against evolving threats, A minimum of 10 years of experience in cybersecurity architecture, with at least 5 years in a senior or principal architect role, Proven experience in developing and implementing enterprise security architectures and strategies, Excellent communication skills, with the ability to articulate complex security concepts to both technical and non-technical stakeholders, Expertise in re-architecting and refactoring legacy applications to improve security, scalability, and performance as part of a broader digital transformation initiative, Deep understanding of cloud-native security controls, such as identity and access management (IAM), encryption, network security, and security monitoring in cloud environments, Experience in automating cloud security tasks such as compliance checks, vulnerability assessments, and threat detection using cloud-native and third-party tools, Skills in innovation and finding solutions to complex problems, Proven experience with software development methodologies, including waterfall, agile, and DevSecOps, Strong understanding of the NIST Framework(s), Open Group Architecture Framework (TOGAF), Sherwood Applied Business Security Architecture (SABSA), MITRE ATTCK Framework, Open Security Architecture (OSA) and other relevant industry standards, Bachelors degree in Cybersecurity, Information Technology, Computer Science, or a related field","This critical role will involve close collaboration with leaders across cybersecurity, IT, and operations to ensure the coordination of services and the formulation of a holistic and adaptive security strategy, The Principal Cybersecurity Architect will be instrumental in ensuring that Business Wire maintains a leading architecture that evolves with changing environments, industry requirements, and threats to enhance overall security performance, Lead the development and execution of a comprehensive and innovative enterprise security architecture strategy, Ensure that stakeholder security requirements are thoroughly addressed across all aspects of enterprise architecture, including reference models, segment and solution architectures, and supporting systems, Integrate cybersecurity policies with IT architecture to ensure a cohesive and secure enterprise environment, Ensure security is integrated throughout the system development life cycle and that continuous monitoring practices are in place, Translate technological and environmental conditions, such as laws and regulations, into secure system designs and processes, Ensure all new systems are deployed in alignment with established architecture standards, Develop and maintain business, systems, and information processes that support Business Wires mission and enterprise needs, Establish and document IT rules and requirements that describe baseline and target architectures, ensuring alignment with organizational goals, Compliance with Industry Standards:, Ensure that the enterprise security architecture complies with major industry frameworks, including the NIST Cybersecurity Framework, Continuously monitor and update the security architecture to maintain alignment with evolving industry standards and best practices, Document and address the organizations information security, cybersecurity architecture, and systems security engineering requirements throughout the acquisition life cycle, Review IT acquisitions for compliance with architecture and policy requirements, ensuring that new systems or interfaces do not compromise the security posture of the current environment, Conduct post-integration reviews to assess the effectiveness of newly integrated security solutions, identifying areas for improvement and driving continuous enhancements, Perform security reviews to identify gaps in the security architecture and develop comprehensive security risk management plans, Provide expert advice on project costs, design concepts, and design changes to ensure that existing systems maintain proper security controls and compliance with architecture policies, Develop metrics and performance indicators to evaluate the success of integration efforts, ensuring that security solutions deliver expected outcomes and contribute to the overall security posture, Lead the creation of a strategy for a comprehensive suite of integrated and dynamic security tools and monitoring technologies, Support system authorization, continuous monitoring, threat detection and response, and other enterprise-level security activities, Lead the exploration of advanced security technologies such as zero-trust architectures, artificial intelligence, machine learning, and blockchain to determine their potential integration into the enterprise security framework, Develop and maintain a forward-looking technology roadmap for security architecture, identifying opportunities for the adoption of new technologies and methodologies that can enhance security and operational efficiency","What We OfferThe base salary range for this position is 180K to 200K/year, Offered salary will be determined by several factors, including but not limited to: applicants education, experience, knowledge, skills and abilities, as well as internal equity and alignment with geographic market data, Business Wire reserves the right to modify this salary range at any time, Business Wires total rewards include:- Ability to work remotely, Excellent health benefits that begin on your first day of employment, 100 monthly fitness allotment, a tuition reimbursement program, and enhanced mental health resources, 401(k) plan with generous company match, and annual profit sharing contribution (subject to company performance), PTO, Floating Holidays, Wellness Day Off, Birthday Day Off, and more",FULLTIME,false,120,True,,,US,,,Business Wire,http://www.venturebeat.com,The Org
